Practice Area,Practice Area Summary,Practice Area Description,ImageTransporter accident,Fusce scelerisque ligula a tortor volutpat interdum. Nam tincidunt luctus elit non ullamcorper. In feugiat tempus nunc vel ultricies.,"<p>Duis in justo finibus, vestibulum felis laoreet, <strong>pretium elit</strong>. Integer ornare, nulla in commodo volutpat, lectus augue finibus sapien, ut sollicitudin lorem felis in nibh. Ut nec pulvinar massa. Aenean accumsan blandit dapibus. Ut a enim libero. Nam at gravida arcu, vitae hendrerit tellus. Morbi vel urna sed neque molestie sollicitudin ut at risus. Phasellus at condimentum ante. Morbi non gravida massa.</p><p>Morbi egestas ante id arcu interdum, quis maximus leo malesuada. Aenean blandit viverra tellus eget congue. Morbi condimentum, sem in ornare malesuada, <a href=""https://www.google.com/"">lectus risus bibendum tellus</a>, at fringilla dui libero tempor magna. In nec condimentum justo. Vestibulum vulputate elit non purus porta, at rhoncus diam fringilla. Nam vitae tincidunt odio, in sollicitudin massa. Curabitur sodales sem quis tempor rutrum. Nunc sed mi sollicitudin, aliquet neque ac, vestibulum mi. Nulla tellus nisl, sagittis quis risus ac, laoreet auctor velit. Vestibulum ante ipsum primis in faucibus orci luctus et ultrices posuere cubilia Curae; Ut tempor nisi et vulputate commodo.</p><p><strong>Ut ullamcorper sit</strong> amet est ac porttitor. Curabitur ut purus non mi maximus porttitor a eget felis. Duis mauris nisi, lacinia sed laoreet vel, condimentum vitae eros. Integer suscipit elit nec blandit mollis. Vestibulum consectetur nunc ac nulla feugiat sollicitudin. Aenean ut lacinia leo, vitae imperdiet ipsum. Etiam semper facilisis orci eu luctus. Phasellus quis efficitur turpis. Nullam hendrerit consequat lectus, ut <a href=""https://www.google.com/"">vulputate felis scelerisque</a> quis. Cras non tincidunt dolor. Suspendisse quis turpis nec augue ultrices auctor. Aliquam id elit rhoncus, tincidunt turpis finibus, fringilla neque. Donec non rutrum nibh. Suspendisse nibh quam, accumsan sed magna ut, interdum auctor lectus. Donec dictum gravida purus, nec finibus augue viverra vitae. Etiam non euismod nibh, sit amet rhoncus eros.</p>",https://daks2k3a4ib2z.cloudfront.net/5a4fb7c235a8000001338957/5a4fe9d535a800000133b50c_transporter%20accident.jpgAsteroid mining rights,"Phasellus ornare leo in massa tristique aliquet. Quisque volutpat augue dapibus, euismod enim eget, volutpat urna. Sed semper .","<p>Ut sit amet placerat justo. Donec feugiat porta finibus. Duis urna tortor, malesuada ac pulvinar vel, porttitor ut nisl. Nam a tellus semper, convallis sem at, volutpat purus. Curabitur venenatis <em>condimentum ligula eu gravida</em>. Sed aliquam, arcu sit amet pellentesque blandit, diam felis varius mauris, et elementum quam diam quis arcu. Aenean fringilla purus mauris, a accumsan ante ultricies et. Nunc tincidunt urna vel libero placerat cursus. Quisque luctus turpis non felis consectetur vehicula.</p><p>Cras aliquam sem <strong>imperdiet orci aliquam faucibus</strong>. Quisque condimentum efficitur finibus. Sed sit amet lacus pellentesque, varius mi id, gravida augue. Mauris vitae ipsum eget sem vestibulum ultricies sed sed augue. Integer eu lacinia purus. Nullam pellentesque a enim vitae vehicula. Morbi volutpat vitae leo venenatis vestibulum. Nullam maximus urna sit amet lacus fringilla vestibulum. Nullam sed justo quis nibh fringilla accumsan lacinia at lacus.</p><p>Nam tristique ligula risus, sit amet malesuada nisl congue vitae. <em>Maecenas egestas urna a mauris</em> pretium, id ultrices nibh tempor. Suspendisse malesuada risus erat, convallis blandit lorem semper nec. Sed eget elit lacinia, cursus felis non, tincidunt felis. Integer id nulla a nibh fermentum sollicitudin sit amet <a href=""https://www.google.com/"">quis orci</a>. Integer vitae magna ut libero sollicitudin ultricies in at neque. Maecenas sit amet magna sit amet enim bibendum suscipit. Nunc justo lectus, sollicitudin in massa et, accumsan lobortis quam. Integer congue interdum sagittis.</p><p>Aenean ultrices mauris eget varius tincidunt. Sed et rhoncus neque, sit amet tristique purus. Pellentesque gravida urna lorem, in dictum ligula dignissim ac. Etiam pulvinar felis dui, nec mattis sem mattis sit amet. Nullam elit ex, sodales id leo interdum, gravida mollis est. Proin faucibus sem eget imperdiet imperdiet. Morbi consequat cursus lacinia.</p><p>Fusce ipsum metus, <a href=""https://www.google.com/"">pretium eget justo et</a>, tempor ornare enim. Class aptent taciti sociosqu ad litora torquent per conubia nostra, per inceptos himenaeos. Proin egestas erat orci, et fringilla tortor eleifend gravida. Etiam bibendum sodales eros, in pulvinar neque facilisis in. Phasellus est urna, eleifend non tempor nec, <em>luctus egestas lorem</em>. Fusce imperdiet nec sem quis commodo. Mauris luctus, ante at interdum rhoncus, nulla massa rhoncus nibh, non tristique felis nisi eu ligula. Ut blandit ligula faucibus, interdum erat quis, fermentum tellus. Nunc ut odio quis ante ultrices porta eget et augue. Integer vel blandit ex. Phasellus commodo, orci ut venenatis dapibus, erat ante congue ex, eget bibendum lectus orci at tortor. Donec vel lacus imperdiet, vulputate turpis non, ultrices eros. <strong>Praesent sed tempor</strong> tortor, vel maximus diam. Aenean tellus justo, scelerisque vitae bibendum ac, elementum lobortis massa.</p>",https://daks2k3a4ib2z.cloudfront.net/5a4fb7c235a8000001338957/5a4fe9d530cd7400011a31f5_asteroid.jpgNebulous claims,Interdum et malesuada fames ac ante ipsum primis in faucibus. Nunc non malesuada risus. Donec bibendum et metus ut auctor. ,"<p>Interdum et malesuada fames ac ante ipsum primis in faucibus. In mauris dolor, accumsan id turpis ut, elementum bibendum nulla. Aliquam finibus ante vel libero sollicitudin luctus. Fusce eget orci at nisl interdum laoreet. Nulla arcu dui, varius a imperdiet a, rutrum ac augue. Sed vitae dolor neque. <em>Vestibulum mattis nisl a turpis</em> viverra gravida. Duis molestie, sapien eget interdum tincidunt, dui ipsum faucibus ante, nec faucibus neque metus in eros. Maecenas eu bibendum velit, sit amet egestas velit. Sed condimentum erat in ex vestibulum maximus. Mauris condimentum, felis id dictum tempus, dolor erat blandit ex, ac suscipit nisl sapien at massa. Donec eu nisl non ipsum ullamcorper aliquam. Etiam pretium tellus eu dolor dignissim, vitae tincidunt ligula egestas. Nullam viverra turpis et arcu venenatis interdum. Sed eu venenatis elit. Sed non eros mollis, ornare nunc id, molestie quam.</p><p>Etiam bibendum a ante in faucibus. In vitae urna vitae arcu ultricies mollis. Integer scelerisque mauris at sem laoreet, malesuada tempor erat mattis. Etiam vel felis <em>vel sapien interdum sollicitudin non</em> vel ex. In condimentum at lorem posuere venenatis. Duis iaculis nisl lorem, vitae vulputate mauris mollis in. Nulla facilisi. Aenean blandit nisl ac purus aliquam lobortis. Duis cursus tortor mauris, ac finibus dolor viverra sed. Proin posuere risus in purus dictum bibendum. Quisque eget tempus neque. Phasellus nunc lectus, vulputate eu quam at, sodales sagittis dui. Ut sagittis vestibulum dignissim. Sed sed consectetur neque. Curabitur pretium ac arcu vel ornare.</p><p>Pellentesque imperdiet pellentesque massa, ac rhoncus risus sagittis vitae. Cras euismod nulla in ligula aliquet euismod. Nullam nibh neque, porttitor sit amet urna at, tincidunt <strong>interdum nisi</strong>. <a href=""https://www.google.com/"">Quisque malesuada</a> ac sem et gravida. Quisque risus metus, auctor eu rhoncus a, vestibulum consectetur nisl. Sed nisi magna, pharetra sed tristique id, porttitor ac sapien. Donec non massa ac eros facilisis iaculis. Nam eu enim erat. In ullamcorper dignissim libero ut molestie. Phasellus vitae eleifend eros. Quisque nec consequat orci, eget finibus nulla. Quisque tincidunt molestie massa, ut eleifend erat molestie quis.</p><p>Class aptent taciti sociosqu ad litora torquent per conubia nostra, per inceptos himenaeos. Nunc ultricies arcu non mi pulvinar porta. Sed sagittis lectus fermentum, gravida augue sit amet, aliquam dolor. Vestibulum efficitur dignissim nisl, quis luctus orci efficitur sed. Sed congue dolor ac volutpat tristique. Mauris a posuere purus. In sed dui eleifend, pretium ipsum at, eleifend turpis. Nullam porta nisl sed <em>orci blandit, eget congue massa</em> malesuada. Fusce consectetur malesuada risus id fermentum. Pellentesque ac ipsum malesuada, sollicitudin eros sed, dignissim tortor. Mauris libero nisl, vehicula nec accumsan sit amet, congue non justo. Fusce nec ipsum lacus. Donec viverra, turpis at viverra semper, enim eros commodo augue, pulvinar facilisis purus justo vel magna.</p><p>Donec vehicula odio elementum commodo hendrerit. Fusce libero enim, aliquam quis tincidunt quis, maximus sed ante. Curabitur tincidunt est non lorem maximus porttitor. Praesent sollicitudin, nibh in venenatis varius, turpis enim mattis justo, sit amet vestibulum ex diam et neque. Integer vehicula magna sit amet mauris consequat varius. Donec condimentum lacinia nulla, vitae efficitur nisl. In eu fermentum nisl. Vestibulum leo metus, pellentesque ut ligula tristique, malesuada convallis urna. Etiam laoreet condimentum neque non viverra. Maecenas tincidunt, magna a facilisis volutpat, leo turpis porttitor turpis, id rutrum diam velit malesuada dolor.</p><p>Donec non nisl et dolor faucibus euismod eu nec nunc. Vivamus et tellus ullamcorper, vulputate nisl vitae, vulputate lorem. Nullam pretium laoreet eros nec ultrices. <em>Donec tempus diam non lectus auctor volutpat.</em> Integer consequat diam nec magna pretium, eu dictum dolor condimentum. Quisque <strong>bibendum augue et</strong> finibus vestibulum. Morbi eget facilisis velit, vitae condimentum felis. Vivamus facilisis tempor finibus. Etiam tellus dui, tempus sed sapien in, cursus hendrerit elit. Praesent tristique porta justo, non consequat mauris sollicitudin eu. Nunc condimentum non neque non lacinia.</p><p>Nam ac justo vel urna vulputate euismod eget in velit. Nam at nulla odio. Pellentesque nec aliquam neque, ac molestie nisl. Fusce pretium ex quis tortor fermentum, et auctor magna scelerisque. Praesent quam tellus, pharetra sed luctus ac, finibus quis enim. <a href=""https://www.google.com/"">Etiam non neque ac tortor</a> tempus blandit in congue sapien. Suspendisse iaculis ipsum sit amet mauris fermentum, et tempor urna venenatis. Vivamus non eleifend purus. Pellentesque aliquet eget nibh eget ultricies. Curabitur efficitur sed ante et viverra. In sit amet urna dictum, dictum turpis sed, faucibus lorem. Donec lacinia volutpat imperdiet. Ut sollicitudin ut erat eu accumsan. Fusce sit amet ipsum vel dui vulputate fringilla nec eget nisl. Vivamus eu nunc dapibus, laoreet ipsum ut, fringilla enim. Vivamus porta elementum est, vel rutrum sapien vehicula at.</p>",https://daks2k3a4ib2z.cloudfront.net/5a4fb7c235a8000001338957/5a4fe9d6140943000185b04b_prime%20directive.jpgTemporal prime directive,"Duis molestie nunc augue, at consequat velit venenatis sit amet. Pellentesque vel imperdiet purus, sit amet sodales vulputate felis.","<p>Quisque neque metus, luctus sit amet finibus ut, porttitor in metus. Interdum et malesuada fames ac ante ipsum primis in faucibus. Curabitur nisi quam, posuere at magna non, posuere suscipit nibh. Donec et arcu eu justo vestibulum tempor eget in lorem. Duis sagittis nisi sed eros ultrices finibus. Quisque et finibus tortor. Maecenas interdum malesuada dui ac finibus. Vestibulum mattis tortor leo, et fringilla turpis aliquam in. Lorem ipsum dolor sit amet, consectetur adipiscing elit.</p><p>Nulla facilisi. Curabitur accumsan mi id libero malesuada, <a href=""https://www.google.com/"">et facilisis dolor</a> accumsan. Donec semper mauris eget velit posuere, at rutrum enim fermentum. Aenean elementum tristique tortor at eleifend. Suspendisse quis lacus id massa egestas faucibus nec nec purus. <em>Nulla ultrices sed</em> nisl at molestie. Vivamus malesuada congue laoreet. Proin sed pharetra nibh, eu sagittis purus. Nullam auctor ex a sodales consectetur. Etiam sollicitudin et nulla ac iaculis. Ut sem dui, placerat vel quam quis, vehicula fermentum dolor.</p><p>Maecenas eleifend at nisl sed posuere. Donec ut lectus venenatis, varius diam quis, finibus dolor. Etiam non scelerisque dolor, eget vehicula sem. Maecenas consectetur ultrices sem eget pretium. Donec non massa consequat, imperdiet neque non, luctus orci. In eget egestas leo. Nulla rutrum lorem rhoncus sodales facilisis.</p><p>Cras laoreet at velit ac porta. Aliquam ac ullamcorper dui, lacinia efficitur quam. Vestibulum dictum enim magna, vitae pharetra metus mattis vitae. Mauris at faucibus ligula. <a href=""https://www.google.com/"">Nunc ut urna semper</a>, imperdiet diam nec, egestas risus. Pellentesque ut erat rutrum, accumsan metus non, viverra justo. Praesent blandit sollicitudin turpis. Mauris accumsan ex a arcu vestibulum, vitae faucibus lorem posuere. Vestibulum ante ipsum primis in faucibus orci luctus et ultrices posuere cubilia Curae; Donec ullamcorper molestie lectus in auctor. Donec convallis justo vitae ante sagittis aliquet. Orci varius natoque penatibus et magnis dis parturient montes, nascetur ridiculus mus.</p><p>Maecenas condimentum egestas lacus in rutrum. Mauris vel magna viverra, suscipit velit vel, feugiat risus. Suspendisse faucibus diam sed mattis vehicula. Integer tincidunt, <strong>augue at laoreet sodales</strong>, risus ante dapibus nisi, quis euismod purus dui vel sem. Mauris condimentum orci sit amet magna convallis ullamcorper. Aliquam massa sem, scelerisque at imperdiet sed, laoreet non ante. Pellentesque nec quam scelerisque, volutpat nibh nec, sollicitudin nulla. Nunc aliquet lacus et mi consequat, at viverra dolor placerat. Vestibulum vitae purus laoreet, consequat libero eu, tincidunt ipsum.</p><p>Donec ullamcorper iaculis erat et hendrerit. <em>Quisque vel nibh ac neque</em> tincidunt vestibulum. In a ligula tincidunt, condimentum odio tincidunt, facilisis est. Fusce quis euismod nisi. Phasellus nisl sem, molestie quis massa sed, dignissim euismod eros. Suspendisse efficitur, massa venenatis finibus vehicula, eros enim molestie eros, eget sodales velit sapien nec tortor. Suspendisse pulvinar urna dictum, rutrum ipsum a, <a href=""https://www.google.com/"">scelerisque erat</a>. Integer accumsan consequat euismod. Fusce elementum nulla sit amet nulla placerat, et fringilla neque porttitor. Orci varius natoque penatibus et magnis dis parturient montes, nascetur ridiculus mus. Mauris nisi urna, rutrum ut euismod quis, hendrerit ut lectus. Morbi ut nisl vel magna venenatis lacinia.</p>",https://daks2k3a4ib2z.cloudfront.net/5a4fb7c235a8000001338957/5a4fe9d60a77cc0001af9274_temporal%20prime%20directive.jpgHolodeck injury,"Etiam sit amet arcu blandit, aliquet mauris vitae, luctus nulla. In quis justo sem. Nullam pulvinar dolor in libero aliquet facilisis.","<p>Proin fringilla nisi a ante vehicula, nec molestie velit dignissim. Fusce purus odio, hendrerit ac lorem quis, ultrices molestie quam. In lectus odio, lacinia eget sollicitudin ac, feugiat egestas tellus. Aliquam convallis tellus non vehicula feugiat. Nulla sed tincidunt neque. Nunc malesuada sem vel est egestas <strong>dignissim</strong>. Aliquam sit amet euismod risus. Nulla sed mi dolor. Donec pretium ante porttitor posuere molestie. Suspendisse potenti. Integer scelerisque mauris quam. Phasellus metus enim, hendrerit id ornare sed, vehicula quis tellus. Proin nec ex a nibh placerat eleifend eu placerat enim.</p><p>Nam elit neque, iaculis a scelerisque at, <a href=""https://www.google.com/"">ullamcorper a quam</a>. Donec tellus diam, sagittis vitae laoreet sed, elementum sit amet augue. Mauris at lacus sodales, facilisis tellus ut, ultrices sem. Duis eget augue at turpis sollicitudin lobortis vitae at leo. Mauris risus purus, fermentum a ante vitae, rhoncus aliquam velit. Mauris laoreet urna id semper blandit. Nulla vehicula nisl id massa lacinia mollis.</p><p>Phasellus blandit orci sit amet blandit imperdiet. Sed ac <strong>fringilla</strong> nibh. Maecenas aliquet tellus libero, ac varius nibh ornare vitae. Duis feugiat nulla vel rutrum hendrerit. Pellentesque fringilla tortor sed augue bibendum scelerisque. Cras eget lacus sollicitudin nulla commodo vulputate. Quisque tristique sem non cursus semper.</p><p>Nulla cursus faucibus eros. Donec rutrum ipsum metus. In hac habitasse platea dictumst. Aliquam ultrices bibendum iaculis. Etiam lacinia placerat arcu a euismod. Phasellus tristique quam vitae risus tempus, eu pellentesque mauris rhoncus. Nulla congue facilisis enim, ac porta lectus scelerisque non. Nunc commodo mi lorem, non imperdiet tortor fermentum faucibus.</p><p>Duis quis tellus vel neque facilisis ultricies in non risus. Pellentesque rutrum ac nisl rhoncus aliquet. Cras et nibh enim. Cras efficitur dui in enim consectetur, a mattis nunc <em>facilisis</em>. Ut <a href=""https://www.google.com/"">pellentesque elit at tortor convallis</a> aliquam. Proin ac dolor tincidunt, venenatis nulla id, ullamcorper nisi. Nulla tincidunt pulvinar varius. Etiam et risus diam. Ut sed nibh consequat, varius dui sit amet, blandit odio. Mauris ante erat, fermentum lacinia porta nec, hendrerit in nulla. Aliquam et condimentum lacus.</p><p>Integer facilisis semper diam, quis ultricies turpis tempus at. <em>Vestibulum ac sapien</em> neque. Cras eu nibh justo. Donec vel placerat ante, vitae dictum velit. Etiam non <strong>ligula</strong> nisi. Duis sollicitudin, ligula sed faucibus tempor, lacus metus porttitor elit, gravida malesuada turpis turpis nec eros. Nam maximus neque sit amet risus dictum interdum. Sed lacinia efficitur auctor. Nulla in euismod augue. Sed fermentum lacus non sapien egestas, et imperdiet urna blandit. Quisque eu tempus justo.</p><p>Aenean lacinia velit a rutrum tristique. Nulla vel rutrum leo. Nunc a arcu <strong>congue libero sollicitudin</strong> mattis. Duis ac condimentum augue. Quisque faucibus velit quis risus tempor vehicula. Maecenas vitae malesuada orci. Phasellus vel augue dapibus, molestie dolor quis, porta orci. Phasellus vehicula sed ex nec volutpat. Aenean at lorem at tellus porttitor ullamcorper eu non ligula. Cras quis hendrerit nunc. Fusce sed fermentum elit. Phasellus rhoncus ullamcorper sapien eget dictum. Nunc cursus massa non arcu commodo fringilla.</p>",https://daks2k3a4ib2z.cloudfront.net/5a4fb7c235a8000001338957/5a4fe9d530cd7400011a31f6_holodeck.jpgRadiation exposure,"Curabitur nec ullamcorper purus, et fermentum ex. Ut sollicitudin leo eu pulvinar mollis. Quisque nec ipsum leo. Donec placerat.","<p>Maecenas sagittis libero vel maximus viverra. Phasellus consequat tristique risus, vitae iaculis felis cursus eu. Nullam nisi elit, bibendum in dui vitae, iaculis aliquet nulla. Nam quis imperdiet lorem. Vestibulum gravida mauris quis leo ultrices, ut gravida metus varius. Vivamus suscipit imperdiet libero id scelerisque. Aliquam erat volutpat. Proin id <a href=""https://www.google.com/"">scelerisque</a> nisi, ut viverra sem. Maecenas porttitor tincidunt ligula id aliquet. Nulla facilisi. Nulla facilisi. Mauris bibendum magna nec faucibus porta. In hac habitasse platea dictumst. Ut augue massa, vehicula eu fermentum non, consequat vel orci. Pellentesque nec imperdiet tellus.</p><p>Nullam diam risus, pulvinar a lorem in, rhoncus condimentum lacus. Praesent tortor leo, laoreet eget tincidunt id, congue et nunc. Cras posuere nunc et est varius, eget condimentum odio consectetur. Ut ut justo tristique, condimentum purus ut, iaculis ipsum. Ut magna ex, consequat id rhoncus vel, viverra quis nibh. Aliquam erat volutpat. In auctor interdum lacinia. Sed nunc libero, hendrerit non ultrices non, facilisis ac tellus. Vestibulum a dui mauris. Vivamus cursus ullamcorper viverra.</p><p>Cras sit amet porttitor sapien, quis placerat ipsum. Praesent a metus ac ante pretium finibus. Maecenas vehicula urna tincidunt tellus faucibus, ut tincidunt mi scelerisque. Sed tincidunt feugiat nibh a placerat. Cras non tincidunt tortor. Pellentesque id interdum sem, vel fringilla purus. Quisque venenatis metus eu massa porttitor ultricies a eget sem. Fusce imperdiet augue eget massa ultricies, sit amet viverra ante ultricies. Donec hendrerit elit id orci commodo egestas.</p><p>Cras pretium <a href=""https://www.google.com/"">malesuada nisi ut ultrices</a>. Integer in imperdiet sapien. Interdum et malesuada fames ac ante ipsum primis in faucibus. Praesent dictum porta sapien, sed <strong>sagittis nisl euismod</strong> at. Pellentesque mattis elit vitae libero eleifend convallis. Maecenas tristique et velit non porttitor. Donec id arcu sit amet nisl cursus feugiat. Donec finibus, erat sit amet scelerisque maximus, arcu leo tempor enim, sed cursus neque arcu ac magna. Integer congue, tellus nec porta placerat, nibh metus aliquet tortor, vitae lobortis ex quam rhoncus ipsum. Nunc eget augue efficitur, tincidunt ligula sit amet, pellentesque libero. Vivamus vel sapien non nisl gravida egestas. Aenean sit amet lorem condimentum velit cursus elementum.</p><p>Aliquam commodo sit amet dui eu sodales. Praesent commodo ipsum sed <a href=""https://www.google.com/"">odio convallis placerat</a>. Nam auctor, justo quis pulvinar dictum, purus mi consequat enim, eu malesuada nibh velit quis elit. Quisque vel auctor arcu. Suspendisse potenti. Ut vel imperdiet mi. Mauris finibus porta nisi, sed gravida sapien cursus a. Nulla pulvinar, tortor sed sodales aliquet, purus est fermentum velit, sit amet condimentum dolor velit sit amet dui.</p><p>Mauris vulputate fermentum tellus, vel <strong>scelerisque lectus faucibus</strong> ac. Ut convallis urna sed nisi congue, a elementum mi pellentesque. Fusce fringilla vel risus id ultrices. Cras eget quam tortor. Vivamus in nisl in odio sollicitudin consequat quis accumsan dolor. Pellentesque habitant morbi tristique senectus et netus et malesuada fames ac turpis egestas. Nunc aliquet ligula id dolor euismod, ac tincidunt mauris scelerisque.</p>",https://daks2k3a4ib2z.cloudfront.net/5a4fb7c235a8000001338957/5a4fe9d5b462b2000143cb74_radiation.jpg