Practice Area,Practice Area Summary,Practice Area Description,ImageSpace construction,"Fusce vehicula justo at volutpat pretium. In mattis mauris eros, ac tempus massa auctor in. Vestibulum mollis sodales egestas.","<p>Quisque pretium lectus in diam commodo lacinia. Aliquam id efficitur nunc. Sed facilisis leo scelerisque, egestas urna ut, lobortis ligula. Aliquam erat volutpat. Proin <a href=""https://www.google.com/"">fringilla sapien arcu</a>, ut malesuada enim hendrerit elementum. Proin sagittis congue tortor, vel porta libero auctor sed. Proin ac tortor vitae neque malesuada luctus et euismod enim. Aliquam sed lectus vel ex luctus commodo.</p><p>Proin eros massa, cursus vitae nisl vel, dictum condimentum magna. Integer bibendum, risus eget convallis auctor, enim velit elementum nulla, ut facilisis metus velit at leo. Sed <strong>mi massa</strong>, vehicula id gravida vitae, viverra in sem. Maecenas non risus semper, condimentum elit sit amet, placerat enim. Curabitur vitae metus sit amet risus mollis tempus eget et ipsum. Integer malesuada vulputate neque, in cursus neque accumsan ut. Nunc varius sem ligula, non dictum metus consequat et.</p><p>Quisque malesuada bibendum auctor. Sed bibendum nunc sit amet quam dignissim, a <a href=""https://www.google.com/"">ultrices lacus faucibus</a>. Aliquam nulla velit, dapibus sed nulla non, commodo rhoncus diam. Nam nec felis mauris. Nunc pretium odio eu metus egestas, in convallis nisl vehicula. Suspendisse ut viverra sem. Sed sit amet nibh ex. Proin posuere, eros non scelerisque consequat, elit felis interdum risus, eu sodales felis tortor nec urna. Mauris bibendum, felis quis varius consectetur, tellus massa consectetur tellus, id suscipit mauris nibh at erat.</p><p>Nulla viverra mi eu lectus auctor, ullamcorper consectetur purus dapibus. In eget dui a tellus interdum accumsan. Nunc pretium tellus sit amet augue porttitor luctus. Cras in egestas turpis, a aliquam urna. In facilisis neque ac est commodo vestibulum nec at tellus. Nunc nec dolor quis turpis tincidunt efficitur eget a mi. Vivamus fermentum tempus ante, a varius sapien facilisis scelerisque. Nam neque elit, venenatis vitae sagittis vel, vulputate eget lacus. Sed posuere interdum turpis, sit amet vehicula enim tempor eget. Vivamus vitae diam tortor. Integer mollis, augue ac ultrices viverra, quam dui convallis risus, eu volutpat tellus dui in urna.</p><p>Pellentesque tempor urna eget diam pretium, non semper enim elementum. Nunc mollis feugiat massa, id bibendum turpis pretium varius. Duis non dapibus tortor. Pellentesque id lacus quis augue dignissim tincidunt. Mauris sodales, tortor et luctus ultrices, dui lorem hendrerit velit, ut commodo erat ante id elit. Cras in bibendum nisi. Integer commodo, urna eu bibendum rutrum, velit urna <strong>hendrerit magna</strong>, eu consequat turpis orci quis dui. Aliquam hendrerit eros quis nunc porta dignissim. In varius, ante nec malesuada venenatis, mauris ipsum ultrices enim, eu lobortis elit neque eu lacus. Etiam tincidunt et eros vitae blandit. Mauris bibendum mattis iaculis. Integer finibus facilisis ornare.</p><p>Pellentesque augue eros, consectetur vulputate metus commodo, auctor faucibus augue. Praesent in tellus vel elit elementum accumsan. Suspendisse augue turpis, eleifend aliquam justo id, condimentum imperdiet enim. Quisque iaculis ullamcorper fermentum. Donec tempor lorem ante, eget <strong>pulvinar purus</strong> tempor non. Quisque blandit lacus et urna luctus, in luctus velit dignissim. Fusce volutpat tortor diam, vitae tempus quam vulputate ut. Maecenas tortor nunc, auctor sit amet urna a, elementum sodales arcu. Maecenas suscipit justo sit amet massa porttitor euismod. Duis at diam massa. Donec suscipit pharetra neque. Proin sit amet lacus efficitur, auctor tortor ut, faucibus dui.</p><p>Suspendisse consectetur, ipsum tempus dignissim viverra, neque mauris porttitor dui, in porta metus nulla sagittis nunc. Mauris convallis, est in faucibus molestie, metus sem rutrum purus, quis suscipit sem sem et magna. Nam malesuada ante sit amet massa tempor, et tristique felis ultricies. In rhoncus pellentesque euismod. Quisque in rhoncus arcu. Suspendisse quis enim sit amet lectus rutrum commodo at vitae mi. <strong>Vivamus non</strong> nulla eget mauris egestas rhoncus consequat et sem. Quisque vitae maximus justo. Vestibulum justo erat, interdum sed porttitor at, sagittis at augue. In iaculis ut mi vehicula suscipit. Maecenas at urna molestie libero tincidunt tincidunt.</p><p>Vivamus rhoncus lacinia commodo. Nulla tempus dui non porta tincidunt. Pellentesque at semper nisi, sit amet vestibulum quam. Fusce dignissim lectus a eros placerat fringilla. Nunc tincidunt felis dolor, eget interdum massa posuere sed. Pellentesque habitant morbi tristique senectus et netus et malesuada fames ac turpis egestas. Suspendisse cursus viverra libero, eu accumsan est molestie accumsan.</p><p>Pellentesque ac massa nunc. Duis varius justo ut mi malesuada, in tristique est eleifend. Maecenas dictum arcu tempus neque rutrum vulputate. Cras porttitor sapien eu <strong>nunc commodo</strong>, finibus rutrum eros aliquet. Aenean vel hendrerit lacus. Praesent egestas faucibus tortor, eu cursus magna egestas non. Integer ultricies consequat elit, vitae fermentum ligula pellentesque at.</p>",https://daks2k3a4ib2z.cloudfront.net/5a4fb7c235a8000001338957/5a4fe9d630cd7400011a31f8_space%20construction.jpg